timestamp,participant_ID,experimenter_ID_code,experimenter_ASGS_total_score,laboratory_ID_code,sitePI_ASGS_total_score,session_type,consent_screen_answer,refused_to_answer_sexual_orientation_question,age,sex,final_consent,ESP_Q_item_1,ESP_Q_item_2,ESP_Q_item_3,SS_Q_item_1,SS_Q_item_2,trial_number,guessed_side,target_side,reward_type,sides_match,trial_type,available_trial_type,in_lab
"e5567ec1341a9555cb36e1441697018506a798c908b67691ca218da2406ba590 Mozilla/5.0 (Macintosh; Intel Mac OS X 10_15_6) AppleWebKit/605.1.15 (KHTML, like Gecko) Version/15.6,2 Safari/605.1.15",e89392a5-5f82-49a2-ad4e-fffd1b6c367a,b4ddf1fa1aa4b5153dedae5fc44b21ad6a854dccacd4436742dda1013138dc13,5,f3406f8fb79141d578bfdbaa385bdba78aed8bc61c54685a2276e7f172ee58db,5,online,NA,NA,NA,NA,NA,NA,NA,NA,NA,NA,NA,NA,NA,NA,NA,NA,1,0
"9ceb3a7a4ba35841cbeb8a554916325f5e5e562d82c4ec73cf2c8489ee1ad005 Mozilla/5.0 (Macintosh; Intel Mac OS X 10_15_6) AppleWebKit/605.1.15 (KHTML, like Gecko) Version/15.6,2 Safari/605.1.15",e89392a5-5f82-49a2-ad4e-fffd1b6c367a,b4ddf1fa1aa4b5153dedae5fc44b21ad6a854dccacd4436742dda1013138dc13,5,f3406f8fb79141d578bfdbaa385bdba78aed8bc61c54685a2276e7f172ee58db,5,online,yes,NA,NA,NA,NA,NA,NA,NA,NA,NA,NA,NA,NA,NA,NA,NA,1,0
"e3958b1a754f6157ddfe6f69c9333c3a883edbb88b809c0633f6f24d412055f7 Mozilla/5.0 (Macintosh; Intel Mac OS X 10_15_6) AppleWebKit/605.1.15 (KHTML, like Gecko) Version/15.6,2 Safari/605.1.15",e89392a5-5f82-49a2-ad4e-fffd1b6c367a,b4ddf1fa1aa4b5153dedae5fc44b21ad6a854dccacd4436742dda1013138dc13,5,f3406f8fb79141d578bfdbaa385bdba78aed8bc61c54685a2276e7f172ee58db,5,online,yes,yes,18-29,Male,NA,NA,NA,NA,NA,NA,NA,NA,NA,NA,NA,NA,1,0
cb4f626fbe32882fb520d2872b0ff6c6516ab21ab309c7d8983d910da496747b Mozilla/5.0 (Windows NT 10.0; Win64; x64; rv:102.0) Gecko/20100101 Firefox/102.0,673d2a81-1df2-4bbe-b696-6a2728ee0e51,b4ddf1fa1aa4b5153dedae5fc44b21ad6a854dccacd4436742dda1013138dc13,5,f3406f8fb79141d578bfdbaa385bdba78aed8bc61c54685a2276e7f172ee58db,5,online,NA,NA,NA,NA,NA,NA,NA,NA,NA,NA,NA,NA,NA,NA,NA,NA,1,0
"450956b89e71dda41e0f5c06ea00b7dfb31cbb889e1298dbfaecf7df8a25614b Mozilla/5.0 (Windows NT 10.0; Win64; x64) AppleWebKit/537.36 (KHTML, like Gecko) Chrome/106.0.0.0 Safari/537.36",2462ed27-bd5b-4228-aee3-ed512ac89005,b4ddf1fa1aa4b5153dedae5fc44b21ad6a854dccacd4436742dda1013138dc13,5,f3406f8fb79141d578bfdbaa385bdba78aed8bc61c54685a2276e7f172ee58db,5,online,NA,NA,NA,NA,NA,NA,NA,NA,NA,NA,NA,NA,NA,NA,NA,NA,1,0
"837edccc95328f2abf0f6f2b59beca188db94191c1344e8b4999e944ba2fda47 Mozilla/5.0 (Windows NT 10.0; Win64; x64) AppleWebKit/537.36 (KHTML, like Gecko) Chrome/106.0.0.0 Safari/537.36",2462ed27-bd5b-4228-aee3-ed512ac89005,b4ddf1fa1aa4b5153dedae5fc44b21ad6a854dccacd4436742dda1013138dc13,5,f3406f8fb79141d578bfdbaa385bdba78aed8bc61c54685a2276e7f172ee58db,5,online,yes,NA,NA,NA,NA,NA,NA,NA,NA,NA,NA,NA,NA,NA,NA,NA,1,0
4aba61b424cf26519bf8c1de672433d4a6fd2f64fe76e0853e9134ed9334d7e3 Mozilla/5.0 (Windows NT 10.0; Win64; x64; rv:102.0) Gecko/20100101 Firefox/102.0,673d2a81-1df2-4bbe-b696-6a2728ee0e51,b4ddf1fa1aa4b5153dedae5fc44b21ad6a854dccacd4436742dda1013138dc13,5,f3406f8fb79141d578bfdbaa385bdba78aed8bc61c54685a2276e7f172ee58db,5,online,yes,NA,NA,NA,NA,NA,NA,NA,NA,NA,NA,NA,NA,NA,NA,NA,1,0
"f1f68948e7389d3410ef0de044dbb1707458a8995bb38133ccdc5d7ebd4c32eb Mozilla/5.0 (Windows NT 10.0; WOW64) AppleWebKit/537.36 (KHTML, like Gecko) Chrome/103.0.0.0 Safari/537.36",5faa811f-3727-4850-b8f9-74e42e6251b3,b4ddf1fa1aa4b5153dedae5fc44b21ad6a854dccacd4436742dda1013138dc13,5,f3406f8fb79141d578bfdbaa385bdba78aed8bc61c54685a2276e7f172ee58db,5,online,yes,no,45-59,Male,yes,Don’t know,Definitely no,"No, never",very true,very true,1,right,right,erotic,true,t,1,0
"307ed0dba75e97c4383079891d5571b63bf7f3259e1969fac46981b0ce5501cf Mozilla/5.0 (Windows NT 10.0; Win64; x64) AppleWebKit/537.36 (KHTML, like Gecko) Chrome/106.0.0.0 Safari/537.36",2462ed27-bd5b-4228-aee3-ed512ac89005,b4ddf1fa1aa4b5153dedae5fc44b21ad6a854dccacd4436742dda1013138dc13,5,f3406f8fb79141d578bfdbaa385bdba78aed8bc61c54685a2276e7f172ee58db,5,online,yes,no,45-59,Male,NA,NA,NA,NA,NA,NA,NA,NA,NA,NA,NA,NA,1,0
"8fa5b94bec2aa450cc2604e6ad9e730286727ef4c4dd8d315878e3c12b6d7540 Mozilla/5.0 (Windows NT 10.0; WOW64) AppleWebKit/537.36 (KHTML, like Gecko) Chrome/103.0.0.0 Safari/537.36",5faa811f-3727-4850-b8f9-74e42e6251b3,b4ddf1fa1aa4b5153dedae5fc44b21ad6a854dccacd4436742dda1013138dc13,5,f3406f8fb79141d578bfdbaa385bdba78aed8bc61c54685a2276e7f172ee58db,5,online,yes,no,45-59,Male,yes,Don’t know,Definitely no,"No, never",very true,very true,2,right,right,neutral,true,t,1,0
cef4829657ed0b7bee666e75de23b79287f002ace7f24dc7b85bef69bd9d834c Mozilla/5.0 (Windows NT 10.0; Win64; x64; rv:102.0) Gecko/20100101 Firefox/102.0,673d2a81-1df2-4bbe-b696-6a2728ee0e51,b4ddf1fa1aa4b5153dedae5fc44b21ad6a854dccacd4436742dda1013138dc13,5,f3406f8fb79141d578bfdbaa385bdba78aed8bc61c54685a2276e7f172ee58db,5,online,yes,no,60+,Female,NA,NA,NA,NA,NA,NA,NA,NA,NA,NA,NA,NA,1,0
"3c166296c8f2b27ad78971df9f371a2370fee9e96eaf6d3dbb6142a8d922c00d Mozilla/5.0 (Windows NT 10.0; WOW64) AppleWebKit/537.36 (KHTML, like Gecko) Chrome/103.0.0.0 Safari/537.36",5faa811f-3727-4850-b8f9-74e42e6251b3,b4ddf1fa1aa4b5153dedae5fc44b21ad6a854dccacd4436742dda1013138dc13,5,f3406f8fb79141d578bfdbaa385bdba78aed8bc61c54685a2276e7f172ee58db,5,online,yes,no,45-59,Male,yes,Don’t know,Definitely no,"No, never",very true,very true,3,right,right,erotic,true,t,1,0
de9658b4c6bc32a3c0943fae48fb03ba4f98782359097b225719ab1c2a1afbc8 Mozilla/5.0 (Windows NT 10.0; Win64; x64; rv:102.0) Gecko/20100101 Firefox/102.0,673d2a81-1df2-4bbe-b696-6a2728ee0e51,b4ddf1fa1aa4b5153dedae5fc44b21ad6a854dccacd4436742dda1013138dc13,5,f3406f8fb79141d578bfdbaa385bdba78aed8bc61c54685a2276e7f172ee58db,5,online,yes,no,60+,Female,no,NA,NA,NA,NA,NA,NA,NA,NA,NA,NA,NA,1,0
"3b81d7077b91dcf1d81299eb3883a5ea68a933c63277f06fc0195073577f8ca2 Mozilla/5.0 (Windows NT 10.0; WOW64) AppleWebKit/537.36 (KHTML, like Gecko) Chrome/103.0.0.0 Safari/537.36",5faa811f-3727-4850-b8f9-74e42e6251b3,b4ddf1fa1aa4b5153dedae5fc44b21ad6a854dccacd4436742dda1013138dc13,5,f3406f8fb79141d578bfdbaa385bdba78aed8bc61c54685a2276e7f172ee58db,5,online,yes,no,45-59,Male,yes,Don’t know,Definitely no,"No, never",very true,very true,4,left,right,neutral,false,t,1,0
"d0a03fff18c73dcb42003737eefdbc714814ee0b017c539638d2efb0ff515166 Mozilla/5.0 (Windows NT 10.0; Win64; x64) AppleWebKit/537.36 (KHTML, like Gecko) Chrome/106.0.0.0 Safari/537.36",2462ed27-bd5b-4228-aee3-ed512ac89005,b4ddf1fa1aa4b5153dedae5fc44b21ad6a854dccacd4436742dda1013138dc13,5,f3406f8fb79141d578bfdbaa385bdba78aed8bc61c54685a2276e7f172ee58db,5,online,yes,no,45-59,Male,yes,Probably does not,Probably no,"No, never",NA,NA,NA,NA,NA,NA,NA,NA,1,0
"3369895b1feefa8a582d0193eadab0fe0f30ab87acc0252785730f1067479d02 Mozilla/5.0 (Windows NT 10.0; WOW64) AppleWebKit/537.36 (KHTML, like Gecko) Chrome/103.0.0.0 Safari/537.36",5faa811f-3727-4850-b8f9-74e42e6251b3,b4ddf1fa1aa4b5153dedae5fc44b21ad6a854dccacd4436742dda1013138dc13,5,f3406f8fb79141d578bfdbaa385bdba78aed8bc61c54685a2276e7f172ee58db,5,online,yes,no,45-59,Male,yes,Don’t know,Definitely no,"No, never",very true,very true,5,right,left,neutral,false,t,1,0
628dd4b945bab3badf0e30bdae2fe4e6a3da726d133c0260efd3cdbbe32c82c8 Mozilla/5.0 (Windows NT 10.0; Win64; x64; rv:106.0) Gecko/20100101 Firefox/106.0,76a1bccb-4fa3-49ce-97ac-4032486f15b8,b4ddf1fa1aa4b5153dedae5fc44b21ad6a854dccacd4436742dda1013138dc13,5,f3406f8fb79141d578bfdbaa385bdba78aed8bc61c54685a2276e7f172ee58db,5,online,NA,NA,NA,NA,NA,NA,NA,NA,NA,NA,NA,NA,NA,NA,NA,NA,1,0
"7b847085a259f67eaa8f4537c201b6a2f9393d97e65d897efe7e3e4934f013fc Mozilla/5.0 (Windows NT 10.0; WOW64) AppleWebKit/537.36 (KHTML, like Gecko) Chrome/103.0.0.0 Safari/537.36",5faa811f-3727-4850-b8f9-74e42e6251b3,b4ddf1fa1aa4b5153dedae5fc44b21ad6a854dccacd4436742dda1013138dc13,5,f3406f8fb79141d578bfdbaa385bdba78aed8bc61c54685a2276e7f172ee58db,5,online,yes,no,45-59,Male,yes,Don’t know,Definitely no,"No, never",very true,very true,6,right,right,erotic,true,t,1,0
150116dbea3a06e22fc60ad87f72d24e74830b60a37fa58188abb4821b515a7b Mozilla/5.0 (Windows NT 10.0; Win64; x64; rv:106.0) Gecko/20100101 Firefox/106.0,76a1bccb-4fa3-49ce-97ac-4032486f15b8,b4ddf1fa1aa4b5153dedae5fc44b21ad6a854dccacd4436742dda1013138dc13,5,f3406f8fb79141d578bfdbaa385bdba78aed8bc61c54685a2276e7f172ee58db,5,online,yes,NA,NA,NA,NA,NA,NA,NA,NA,NA,NA,NA,NA,NA,NA,NA,1,0
"0bfee91ee2b95366d67b3ef278139b3f51c0ac65f85ab0d185ca82b5d8aa7e24 Mozilla/5.0 (Windows NT 10.0; Win64; x64) AppleWebKit/537.36 (KHTML, like Gecko) Chrome/106.0.0.0 Safari/537.36",2462ed27-bd5b-4228-aee3-ed512ac89005,b4ddf1fa1aa4b5153dedae5fc44b21ad6a854dccacd4436742dda1013138dc13,5,f3406f8fb79141d578bfdbaa385bdba78aed8bc61c54685a2276e7f172ee58db,5,online,yes,no,45-59,Male,yes,Probably does not,Probably no,"No, never",between true and untrue,untrue,NA,NA,NA,NA,NA,NA,1,0
"83ef083036a502ae09089d75874ecc706eed26c638bfc685e921b7ddb897282b Mozilla/5.0 (Windows NT 10.0; WOW64) AppleWebKit/537.36 (KHTML, like Gecko) Chrome/103.0.0.0 Safari/537.36",5faa811f-3727-4850-b8f9-74e42e6251b3,b4ddf1fa1aa4b5153dedae5fc44b21ad6a854dccacd4436742dda1013138dc13,5,f3406f8fb79141d578bfdbaa385bdba78aed8bc61c54685a2276e7f172ee58db,5,online,yes,no,45-59,Male,yes,Don’t know,Definitely no,"No, never",very true,very true,7,right,right,neutral,true,t,1,0
"bdf1e2b10c372d44ee24d0e30d6d2b0f1ea660ea1c9b25d32021a0aa870c7eee Mozilla/5.0 (Windows NT 10.0; WOW64) AppleWebKit/537.36 (KHTML, like Gecko) Chrome/103.0.0.0 Safari/537.36",5faa811f-3727-4850-b8f9-74e42e6251b3,b4ddf1fa1aa4b5153dedae5fc44b21ad6a854dccacd4436742dda1013138dc13,5,f3406f8fb79141d578bfdbaa385bdba78aed8bc61c54685a2276e7f172ee58db,5,online,yes,no,45-59,Male,yes,Don’t know,Definitely no,"No, never",very true,very true,8,right,left,erotic,false,t,1,0
"660d7b0d74828719e22875c3b45ca67e205a14cdb1832c153f82fbafa3c81212 Mozilla/5.0 (Windows NT 10.0; Win64; x64) AppleWebKit/537.36 (KHTML, like Gecko) Chrome/106.0.0.0 Safari/537.36",5a8b90e4-7746-48ff-8a21-e248e73cf1b4,b4ddf1fa1aa4b5153dedae5fc44b21ad6a854dccacd4436742dda1013138dc13,5,f3406f8fb79141d578bfdbaa385bdba78aed8bc61c54685a2276e7f172ee58db,5,online,NA,NA,NA,NA,NA,NA,NA,NA,NA,NA,NA,NA,NA,NA,NA,NA,1,0
"cb6b185b76fbb27206dd9961e7d96562df4859b168b34168ba44ad5359df2441 Mozilla/5.0 (Windows NT 10.0; WOW64) AppleWebKit/537.36 (KHTML, like Gecko) Chrome/103.0.0.0 Safari/537.36",5faa811f-3727-4850-b8f9-74e42e6251b3,b4ddf1fa1aa4b5153dedae5fc44b21ad6a854dccacd4436742dda1013138dc13,5,f3406f8fb79141d578bfdbaa385bdba78aed8bc61c54685a2276e7f172ee58db,5,online,yes,no,45-59,Male,yes,Don’t know,Definitely no,"No, never",very true,very true,9,right,left,neutral,false,t,1,0
"b1a3ede32fecda2bd1bb7ef4374d7a0fdcb67746f1afc988a04081939aa45ccf Mozilla/5.0 (Windows NT 10.0; Win64; x64) AppleWebKit/537.36 (KHTML, like Gecko) Chrome/106.0.0.0 Safari/537.36",5a8b90e4-7746-48ff-8a21-e248e73cf1b4,b4ddf1fa1aa4b5153dedae5fc44b21ad6a854dccacd4436742dda1013138dc13,5,f3406f8fb79141d578bfdbaa385bdba78aed8bc61c54685a2276e7f172ee58db,5,online,yes,NA,NA,NA,NA,NA,NA,NA,NA,NA,NA,NA,NA,NA,NA,NA,1,0
d71128d481aeaa4e79041d2623432c494258f12fa0ab4e4a9dd1e47a8463bae1 Mozilla/5.0 (Windows NT 10.0; Win64; x64; rv:106.0) Gecko/20100101 Firefox/106.0,76a1bccb-4fa3-49ce-97ac-4032486f15b8,b4ddf1fa1aa4b5153dedae5fc44b21ad6a854dccacd4436742dda1013138dc13,5,f3406f8fb79141d578bfdbaa385bdba78aed8bc61c54685a2276e7f172ee58db,5,online,yes,no,18-29,Female,NA,NA,NA,NA,NA,NA,NA,NA,NA,NA,NA,NA,1,0
"d71128d481aeaa4e79041d2623432c494258f12fa0ab4e4a9dd1e47a8463bae1 Mozilla/5.0 (Windows NT 10.0; WOW64) AppleWebKit/537.36 (KHTML, like Gecko) Chrome/103.0.0.0 Safari/537.36",5faa811f-3727-4850-b8f9-74e42e6251b3,b4ddf1fa1aa4b5153dedae5fc44b21ad6a854dccacd4436742dda1013138dc13,5,f3406f8fb79141d578bfdbaa385bdba78aed8bc61c54685a2276e7f172ee58db,5,online,yes,no,45-59,Male,yes,Don’t know,Definitely no,"No, never",very true,very true,10,right,right,erotic,true,t,1,0
"fb5bc18fe74a7652b40df515a289b7a0e0143543f178d7a2685ad50666d40cad Mozilla/5.0 (Windows NT 10.0; Win64; x64) AppleWebKit/537.36 (KHTML, like Gecko) Chrome/106.0.0.0 Safari/537.36",5a8b90e4-7746-48ff-8a21-e248e73cf1b4,b4ddf1fa1aa4b5153dedae5fc44b21ad6a854dccacd4436742dda1013138dc13,5,f3406f8fb79141d578bfdbaa385bdba78aed8bc61c54685a2276e7f172ee58db,5,online,yes,no,30-44,Female,NA,NA,NA,NA,NA,NA,NA,NA,NA,NA,NA,NA,1,0
"c8047c652d74bfd7a2c9466536b4af4be2257eb68ce2d56c8c3a5138bedeee0a Mozilla/5.0 (Windows NT 10.0; WOW64) AppleWebKit/537.36 (KHTML, like Gecko) Chrome/103.0.0.0 Safari/537.36",5faa811f-3727-4850-b8f9-74e42e6251b3,b4ddf1fa1aa4b5153dedae5fc44b21ad6a854dccacd4436742dda1013138dc13,5,f3406f8fb79141d578bfdbaa385bdba78aed8bc61c54685a2276e7f172ee58db,5,online,yes,no,45-59,Male,yes,Don’t know,Definitely no,"No, never",very true,very true,11,right,right,neutral,true,t,1,0
"d5b8816b872d18426718eae40d3d36386fb8c8f468bf4f47f48b9033f951154d Mozilla/5.0 (Windows NT 10.0; WOW64) AppleWebKit/537.36 (KHTML, like Gecko) Chrome/103.0.0.0 Safari/537.36",5faa811f-3727-4850-b8f9-74e42e6251b3,b4ddf1fa1aa4b5153dedae5fc44b21ad6a854dccacd4436742dda1013138dc13,5,f3406f8fb79141d578bfdbaa385bdba78aed8bc61c54685a2276e7f172ee58db,5,online,yes,no,45-59,Male,yes,Don’t know,Definitely no,"No, never",very true,very true,12,right,left,erotic,false,t,1,0
"1ed7d2685020080178451ea7099a6f6b5aeb888c96d46fbf5bbde655a14c29ba Mozilla/5.0 (Windows NT 10.0; WOW64) AppleWebKit/537.36 (KHTML, like Gecko) Chrome/103.0.0.0 Safari/537.36",5faa811f-3727-4850-b8f9-74e42e6251b3,b4ddf1fa1aa4b5153dedae5fc44b21ad6a854dccacd4436742dda1013138dc13,5,f3406f8fb79141d578bfdbaa385bdba78aed8bc61c54685a2276e7f172ee58db,5,online,yes,no,45-59,Male,yes,Don’t know,Definitely no,"No, never",very true,very true,13,right,left,erotic,false,t,1,0
9dabc10840e0e817a4fd26cae85710e064e6f101d4ee5b327af219a77cc54429 Mozilla/5.0 (Windows NT 10.0; Win64; x64; rv:106.0) Gecko/20100101 Firefox/106.0,76a1bccb-4fa3-49ce-97ac-4032486f15b8,b4ddf1fa1aa4b5153dedae5fc44b21ad6a854dccacd4436742dda1013138dc13,5,f3406f8fb79141d578bfdbaa385bdba78aed8bc61c54685a2276e7f172ee58db,5,online,yes,no,18-29,Female,yes,Definitely Does not,Definitely no,"No, never",NA,NA,NA,NA,NA,NA,NA,NA,1,0
"7a828fa5d552145d6fd70882948173d2fca6601007e90d16fe503533076cc661 Mozilla/5.0 (Windows NT 10.0; WOW64) AppleWebKit/537.36 (KHTML, like Gecko) Chrome/103.0.0.0 Safari/537.36",5faa811f-3727-4850-b8f9-74e42e6251b3,b4ddf1fa1aa4b5153dedae5fc44b21ad6a854dccacd4436742dda1013138dc13,5,f3406f8fb79141d578bfdbaa385bdba78aed8bc61c54685a2276e7f172ee58db,5,online,yes,no,45-59,Male,yes,Don’t know,Definitely no,"No, never",very true,very true,14,right,right,neutral,true,t,1,0
"1f665fadb607f2f75cc48e61a465a32b8439e4148992400d22db884d4bbfaa53 Mozilla/5.0 (Windows NT 10.0; WOW64) AppleWebKit/537.36 (KHTML, like Gecko) Chrome/103.0.0.0 Safari/537.36",5faa811f-3727-4850-b8f9-74e42e6251b3,b4ddf1fa1aa4b5153dedae5fc44b21ad6a854dccacd4436742dda1013138dc13,5,f3406f8fb79141d578bfdbaa385bdba78aed8bc61c54685a2276e7f172ee58db,5,online,yes,no,45-59,Male,yes,Don’t know,Definitely no,"No, never",very true,very true,15,right,left,erotic,false,t,1,0
a3e5c3576a25066d6f3dad77d41fb8509986b1dcda6dc2e646a8806245e44bf8 Mozilla/5.0 (Windows NT 10.0; Win64; x64; rv:106.0) Gecko/20100101 Firefox/106.0,76a1bccb-4fa3-49ce-97ac-4032486f15b8,b4ddf1fa1aa4b5153dedae5fc44b21ad6a854dccacd4436742dda1013138dc13,5,f3406f8fb79141d578bfdbaa385bdba78aed8bc61c54685a2276e7f172ee58db,5,online,yes,no,18-29,Female,yes,Definitely Does not,Definitely no,"No, never",untrue,between true and untrue,NA,NA,NA,NA,NA,NA,1,0
"770a22be4b086af49f86b9a4e1fe5625405cabace6b5a083060fbe2c42a3b73b Mozilla/5.0 (Windows NT 10.0; WOW64) AppleWebKit/537.36 (KHTML, like Gecko) Chrome/103.0.0.0 Safari/537.36",5faa811f-3727-4850-b8f9-74e42e6251b3,b4ddf1fa1aa4b5153dedae5fc44b21ad6a854dccacd4436742dda1013138dc13,5,f3406f8fb79141d578bfdbaa385bdba78aed8bc61c54685a2276e7f172ee58db,5,online,yes,no,45-59,Male,yes,Don’t know,Definitely no,"No, never",very true,very true,16,left,right,neutral,false,t,1,0
"e04412c7942a06a59e603d85f7e0c22a18816daf7c2b0886040e030767bda056 Mozilla/5.0 (Windows NT 10.0; Win64; x64) AppleWebKit/537.36 (KHTML, like Gecko) Chrome/106.0.0.0 Safari/537.36",5a8b90e4-7746-48ff-8a21-e248e73cf1b4,b4ddf1fa1aa4b5153dedae5fc44b21ad6a854dccacd4436742dda1013138dc13,5,f3406f8fb79141d578bfdbaa385bdba78aed8bc61c54685a2276e7f172ee58db,5,online,yes,no,30-44,Female,yes,Probably does,Probably yes,Only a few times,NA,NA,NA,NA,NA,NA,NA,NA,1,0
"a0437cb4160b6179c6796ed269faa0a8996d89fe30c39c09d7daaeb3d7343af5 Mozilla/5.0 (Windows NT 10.0; WOW64) AppleWebKit/537.36 (KHTML, like Gecko) Chrome/103.0.0.0 Safari/537.36",5faa811f-3727-4850-b8f9-74e42e6251b3,b4ddf1fa1aa4b5153dedae5fc44b21ad6a854dccacd4436742dda1013138dc13,5,f3406f8fb79141d578bfdbaa385bdba78aed8bc61c54685a2276e7f172ee58db,5,online,yes,no,45-59,Male,yes,Don’t know,Definitely no,"No, never",very true,very true,17,right,right,neutral,true,t,1,0
"dd4ff3eea9cc20bbfc8073de220a2f943ae1010d56fba9928c22438be68ff39a Mozilla/5.0 (Macintosh; Intel Mac OS X 10_15_7) AppleWebKit/605.1.15 (KHTML, like Gecko) Version/15.6.1 Safari/605.1.15",7f5413d9-5b37-4022-8801-062d98bf89b6,b4ddf1fa1aa4b5153dedae5fc44b21ad6a854dccacd4436742dda1013138dc13,5,f3406f8fb79141d578bfdbaa385bdba78aed8bc61c54685a2276e7f172ee58db,5,online,NA,NA,NA,NA,NA,NA,NA,NA,NA,NA,NA,NA,NA,NA,NA,NA,1,0
"ba46a8044c5a52a13a338ca99b6278a90d1d21e924e154d19bd129d25582ea8d Mozilla/5.0 (Windows NT 10.0; Win64; x64) AppleWebKit/537.36 (KHTML, like Gecko) Chrome/106.0.0.0 Safari/537.36",5a8b90e4-7746-48ff-8a21-e248e73cf1b4,b4ddf1fa1aa4b5153dedae5fc44b21ad6a854dccacd4436742dda1013138dc13,5,f3406f8fb79141d578bfdbaa385bdba78aed8bc61c54685a2276e7f172ee58db,5,online,yes,no,30-44,Female,yes,Probably does,Probably yes,Only a few times,true,true,NA,NA,NA,NA,NA,NA,1,0
"ba2a1acc28430edb4e6327a1805c360a47c9438dd5196d99b4fbe7853202fcee Mozilla/5.0 (Macintosh; Intel Mac OS X 10_15_7) AppleWebKit/605.1.15 (KHTML, like Gecko) Version/15.6.1 Safari/605.1.15",7f5413d9-5b37-4022-8801-062d98bf89b6,b4ddf1fa1aa4b5153dedae5fc44b21ad6a854dccacd4436742dda1013138dc13,5,f3406f8fb79141d578bfdbaa385bdba78aed8bc61c54685a2276e7f172ee58db,5,online,yes,NA,NA,NA,NA,NA,NA,NA,NA,NA,NA,NA,NA,NA,NA,NA,1,0
"c92e3345f409722da700a49e1440c78f22221dede497b70354ef0183a8233f12 Mozilla/5.0 (Windows NT 10.0; WOW64) AppleWebKit/537.36 (KHTML, like Gecko) Chrome/103.0.0.0 Safari/537.36",5faa811f-3727-4850-b8f9-74e42e6251b3,b4ddf1fa1aa4b5153dedae5fc44b21ad6a854dccacd4436742dda1013138dc13,5,f3406f8fb79141d578bfdbaa385bdba78aed8bc61c54685a2276e7f172ee58db,5,online,yes,no,45-59,Male,yes,Don’t know,Definitely no,"No, never",very true,very true,18,left,left,erotic,true,t,1,0
"d449fa0f56bc11737eff3270b78797946158edca08faecab07fc3b18079454ba Mozilla/5.0 (Windows NT 10.0; WOW64) AppleWebKit/537.36 (KHTML, like Gecko) Chrome/103.0.0.0 Safari/537.36",5faa811f-3727-4850-b8f9-74e42e6251b3,b4ddf1fa1aa4b5153dedae5fc44b21ad6a854dccacd4436742dda1013138dc13,5,f3406f8fb79141d578bfdbaa385bdba78aed8bc61c54685a2276e7f172ee58db,5,online,yes,no,45-59,Male,yes,Don’t know,Definitely no,"No, never",very true,very true,19,left,right,erotic,false,t,1,0
"8000da5e58b1c223838967973f381d6241eac2ea285b24b7daff552cff79cde6 Mozilla/5.0 (Windows NT 10.0; WOW64) AppleWebKit/537.36 (KHTML, like Gecko) Chrome/103.0.0.0 Safari/537.36",5faa811f-3727-4850-b8f9-74e42e6251b3,b4ddf1fa1aa4b5153dedae5fc44b21ad6a854dccacd4436742dda1013138dc13,5,f3406f8fb79141d578bfdbaa385bdba78aed8bc61c54685a2276e7f172ee58db,5,online,yes,no,45-59,Male,yes,Don’t know,Definitely no,"No, never",very true,very true,20,right,left,neutral,false,t,1,0
"9aa158c4f8da25a2cc627a7de78d17fc0a8f83543d61f2b0c6f907b9edb1ef37 Mozilla/5.0 (Macintosh; Intel Mac OS X 10_15_7) AppleWebKit/605.1.15 (KHTML, like Gecko) Version/15.6.1 Safari/605.1.15",7f5413d9-5b37-4022-8801-062d98bf89b6,b4ddf1fa1aa4b5153dedae5fc44b21ad6a854dccacd4436742dda1013138dc13,5,f3406f8fb79141d578bfdbaa385bdba78aed8bc61c54685a2276e7f172ee58db,5,online,yes,no,30-44,Female,NA,NA,NA,NA,NA,NA,NA,NA,NA,NA,NA,NA,1,0
"62b652c7defabfe3bd9ce882f531ba67c2c3fcce60093389414add0e449d1127 Mozilla/5.0 (Windows NT 10.0; WOW64) AppleWebKit/537.36 (KHTML, like Gecko) Chrome/103.0.0.0 Safari/537.36",5faa811f-3727-4850-b8f9-74e42e6251b3,b4ddf1fa1aa4b5153dedae5fc44b21ad6a854dccacd4436742dda1013138dc13,5,f3406f8fb79141d578bfdbaa385bdba78aed8bc61c54685a2276e7f172ee58db,5,online,yes,no,45-59,Male,yes,Don’t know,Definitely no,"No, never",very true,very true,21,right,left,erotic,false,t,1,0
"20219743f253e7d415196b92bdfb3341f9f608a9ee3e3d6c135ac662548551ef Mozilla/5.0 (Windows NT 10.0; WOW64) AppleWebKit/537.36 (KHTML, like Gecko) Chrome/103.0.0.0 Safari/537.36",5faa811f-3727-4850-b8f9-74e42e6251b3,b4ddf1fa1aa4b5153dedae5fc44b21ad6a854dccacd4436742dda1013138dc13,5,f3406f8fb79141d578bfdbaa385bdba78aed8bc61c54685a2276e7f172ee58db,5,online,yes,no,45-59,Male,yes,Don’t know,Definitely no,"No, never",very true,very true,22,right,left,erotic,false,t,1,0
"0ca0f582f250adf9a2342c2cfc93daed99a644995a5bb0ee8fbe598f01a268b9 Mozilla/5.0 (Windows NT 10.0; WOW64) AppleWebKit/537.36 (KHTML, like Gecko) Chrome/103.0.0.0 Safari/537.36",5faa811f-3727-4850-b8f9-74e42e6251b3,b4ddf1fa1aa4b5153dedae5fc44b21ad6a854dccacd4436742dda1013138dc13,5,f3406f8fb79141d578bfdbaa385bdba78aed8bc61c54685a2276e7f172ee58db,5,online,yes,no,45-59,Male,yes,Don’t know,Definitely no,"No, never",very true,very true,23,right,right,neutral,true,t,1,0
"ed0da1306e8b6a73964154c0cf948ef09f7ba7e0a0914c52348794a3891b4e63 Mozilla/5.0 (Windows NT 10.0; WOW64) AppleWebKit/537.36 (KHTML, like Gecko) Chrome/103.0.0.0 Safari/537.36",5faa811f-3727-4850-b8f9-74e42e6251b3,b4ddf1fa1aa4b5153dedae5fc44b21ad6a854dccacd4436742dda1013138dc13,5,f3406f8fb79141d578bfdbaa385bdba78aed8bc61c54685a2276e7f172ee58db,5,online,yes,no,45-59,Male,yes,Don’t know,Definitely no,"No, never",very true,very true,24,right,right,neutral,true,t,1,0
"a532e94a523a32b7ae7d37ead5fd217cf9ef652e2b96ea0ecea4713cf72a2113 Mozilla/5.0 (Macintosh; Intel Mac OS X 10_15_7) AppleWebKit/605.1.15 (KHTML, like Gecko) Version/15.6.1 Safari/605.1.15",7f5413d9-5b37-4022-8801-062d98bf89b6,b4ddf1fa1aa4b5153dedae5fc44b21ad6a854dccacd4436742dda1013138dc13,5,f3406f8fb79141d578bfdbaa385bdba78aed8bc61c54685a2276e7f172ee58db,5,online,yes,no,30-44,Female,yes,Probably does,Probably no,Regularly in the past,NA,NA,NA,NA,NA,NA,NA,NA,1,0
"b708d23195457a99391ff504ebe34ab0a7a961e8214a987b3a023e5746f32be4 Mozilla/5.0 (Windows NT 10.0; WOW64) AppleWebKit/537.36 (KHTML, like Gecko) Chrome/103.0.0.0 Safari/537.36",5faa811f-3727-4850-b8f9-74e42e6251b3,b4ddf1fa1aa4b5153dedae5fc44b21ad6a854dccacd4436742dda1013138dc13,5,f3406f8fb79141d578bfdbaa385bdba78aed8bc61c54685a2276e7f172ee58db,5,online,yes,no,45-59,Male,yes,Don’t know,Definitely no,"No, never",very true,very true,25,left,left,neutral,true,t,1,0
"631c21400f09c56b90c2adb8a6358d1203b1451d63b7cf25ea6bc3bc210be144 Mozilla/5.0 (Macintosh; Intel Mac OS X 10_15_7) AppleWebKit/605.1.15 (KHTML, like Gecko) Version/15.6.1 Safari/605.1.15",7f5413d9-5b37-4022-8801-062d98bf89b6,b4ddf1fa1aa4b5153dedae5fc44b21ad6a854dccacd4436742dda1013138dc13,5,f3406f8fb79141d578bfdbaa385bdba78aed8bc61c54685a2276e7f172ee58db,5,online,yes,no,30-44,Female,yes,Probably does,Probably no,Regularly in the past,true,between true and untrue,NA,NA,NA,NA,NA,NA,1,0
"c260334a9536dd4a6fc2fce6c5e28e89ecc85525d0121147f186f2c2d64234f4 Mozilla/5.0 (Windows NT 10.0; WOW64) AppleWebKit/537.36 (KHTML, like Gecko) Chrome/103.0.0.0 Safari/537.36",5faa811f-3727-4850-b8f9-74e42e6251b3,b4ddf1fa1aa4b5153dedae5fc44b21ad6a854dccacd4436742dda1013138dc13,5,f3406f8fb79141d578bfdbaa385bdba78aed8bc61c54685a2276e7f172ee58db,5,online,yes,no,45-59,Male,yes,Don’t know,Definitely no,"No, never",very true,very true,26,left,left,neutral,true,t,1,0
"11d6a5677a52198dd1d224bc7cc81fbef4556260dfc358f79f8cfb3608b042e7 Mozilla/5.0 (Windows NT 10.0; Win64; x64) AppleWebKit/537.36 (KHTML, like Gecko) Chrome/106.0.5249.103 Safari/537.36",4fd6d525-752c-4d74-972b-1bb02c8f5745,b4ddf1fa1aa4b5153dedae5fc44b21ad6a854dccacd4436742dda1013138dc13,5,f3406f8fb79141d578bfdbaa385bdba78aed8bc61c54685a2276e7f172ee58db,5,online,NA,NA,NA,NA,NA,NA,NA,NA,NA,NA,NA,NA,NA,NA,NA,NA,1,0
"5040678aa6f91126debb5ce24844a1c276b35e521541217f8ab7a33b73492a64 Mozilla/5.0 (Windows NT 10.0; WOW64) AppleWebKit/537.36 (KHTML, like Gecko) Chrome/103.0.0.0 Safari/537.36",5faa811f-3727-4850-b8f9-74e42e6251b3,b4ddf1fa1aa4b5153dedae5fc44b21ad6a854dccacd4436742dda1013138dc13,5,f3406f8fb79141d578bfdbaa385bdba78aed8bc61c54685a2276e7f172ee58db,5,online,yes,no,45-59,Male,yes,Don’t know,Definitely no,"No, never",very true,very true,27,left,left,erotic,true,t,1,0
"3c7399109e2a09912d096617b3ccd9cdc349d7e72e18e56eebe839c107244b19 Mozilla/5.0 (Windows NT 10.0; Win64; x64) AppleWebKit/537.36 (KHTML, like Gecko) Chrome/106.0.5249.103 Safari/537.36",4fd6d525-752c-4d74-972b-1bb02c8f5745,b4ddf1fa1aa4b5153dedae5fc44b21ad6a854dccacd4436742dda1013138dc13,5,f3406f8fb79141d578bfdbaa385bdba78aed8bc61c54685a2276e7f172ee58db,5,online,yes,NA,NA,NA,NA,NA,NA,NA,NA,NA,NA,NA,NA,NA,NA,NA,1,0
"26f56549000e0840c7d36b1a876b3565490c52360c3304d9d6c007e2e7691f6c Mozilla/5.0 (Windows NT 10.0; WOW64) AppleWebKit/537.36 (KHTML, like Gecko) Chrome/103.0.0.0 Safari/537.36",5faa811f-3727-4850-b8f9-74e42e6251b3,b4ddf1fa1aa4b5153dedae5fc44b21ad6a854dccacd4436742dda1013138dc13,5,f3406f8fb79141d578bfdbaa385bdba78aed8bc61c54685a2276e7f172ee58db,5,online,yes,no,45-59,Male,yes,Don’t know,Definitely no,"No, never",very true,very true,28,left,right,erotic,false,t,1,0
"61a09773af23b5608d5a33920944ef36af93cfae296301a669c9cfa804e771e6 Mozilla/5.0 (Windows NT 10.0; Win64; x64) AppleWebKit/537.36 (KHTML, like Gecko) Chrome/106.0.5249.103 Safari/537.36",4fd6d525-752c-4d74-972b-1bb02c8f5745,b4ddf1fa1aa4b5153dedae5fc44b21ad6a854dccacd4436742dda1013138dc13,5,f3406f8fb79141d578bfdbaa385bdba78aed8bc61c54685a2276e7f172ee58db,5,online,yes,no,60+,Male,NA,NA,NA,NA,NA,NA,NA,NA,NA,NA,NA,NA,1,0
